{"event_id":"550e8400-e29b-41d4-a716-446655440030","partition_key":"XSHG","exchange":"XSHG","calendar_id":"CN-A","calendar_version":"cal-v1","session_calendar_version":"cal-v1","session_id":"am","trading_day":"2026-08-11","event_time":"2026-08-11T01:15:00Z","received_at":"2026-08-11T01:15:00.001Z","session_open_at":"2026-08-11T01:30:00Z","session_close_at":"2026-08-11T03:30:00Z","transition_sequence":1,"from_state":"CLOSED","to_state":"PRE_OPEN","reason_code":"CALENDAR_BOUNDARY","timezone":"Asia/Shanghai","tzdb_version":"2026c","session_open_fold":0,"session_close_fold":0,"session_open_utc_offset_seconds":"28800","session_close_utc_offset_seconds":"28800","crosses_local_midnight":false}
